{"application_body_roles":["browser","manager-ui","manager-controller","managed-client","admission","operator","storage-gateway","provider","resolver","party-1","party-2","party-3","party-4","party-5","docker-engine"],"clock":"client-monotonic-nanoseconds","concurrency_observation":["batch-completion-nanoseconds","operations-per-second-milli"],"end_to_end":"client-observed","format_id":"LOCUS-managed-performance-instrumentation-v1","persisted_roles":["admission","bootstrap","managed-client-template","managed-client-instance","manager-controller","manager-ui","operator","party-1","party-2","party-3","party-4","party-5","resolver","provider","s3-role","storage-gateway"],"phase_rule":"fixed-applicable-non-overlapping-and-bounded-by-end-to-end","phases":["policy","resolver","suite-initialization","appss-per-server-initialization","encryption-and-upload","party-provisioning","descriptor-publication-and-retrieval","authorization","recovery","successor"],"positive_controls":["monotonic-clock","phase-nonoverlap","end-to-end-bounds-phases","application-byte-reconciliation","persisted-byte-reconciliation","warmup-precedes-measurement","graph-and-arm-binding","expected-scenario-outcome","failure-schedule-binding","client-identity-rotation","single-client-serialization","invalid-attempt-linkage","prohibited-output-canary","cleanup","raw-to-processed-hash-closure"],"prohibited_content":["payloads","cues-or-canonical-cue-bytes","passwords-or-recovery-secrets","protected-or-private-keys","credentials","request-or-response-bodies","logs-traces-or-packet-captures","host-paths-or-stable-machine-account-identifiers"],"status":"assigned","ui_observation":"host-loopback-http-round-trip-browser-rendering-excluded"}
